{
  "approval_version": "1.0.0",
  "story_id": "NV_MAIN_002",
  "status": "approved",
  "reviewer": "R1.1 reviewed delivery and integration task authorization",
  "approved_at": "2026-07-16T15:45:20.537495Z",
  "source_sha256": "e8027f71bf8179cdb09eb68cbc27c6c71e90c5d46cdc9e13b0f7844c0c2b1e16",
  "canonical_sha256": "5da5a9aa4bb90351f17e93c27bb0a4a4cdd4dde7dbfb79d300e87a129ee422b7",
  "notes": "依据已审核的 R1.1 交付包进行机械结构化；核心对白未改写，系统引用已映射为正式 ID。"
}
